,symbol,category,product_summary,asset_class,risk_level,region,sector
124,VTWIX,World Stock,"Total World Stock Index Fund provides shareholders low-cost exposure to stock markets around the globe, including the United States, developed foreign markets, and emerging markets. In addition to stock market risk, the fund is also subject to currency risk and country risk. Long-term investors seeking global equity exposure who are comfortable with the volatility inherent in stock market investing may wish to consider this fund.",Equity,4,"['Emerging Markets', 'Europe', 'Pacific', 'Middle East', 'North America', 'Other']",
125,VMVLX,Large Value,"Seeks to track the performance of the CRSP US Mega Cap Value Index.Employs a passively managed, full-replication approach.Provides a convenient way to get diversified exposure to the largest value stocks in the U.S. market.",Equity,4,['North America'],"['Basic Materials', 'Consumer Discretionary', 'Consumer Staples', 'Energy', 'Financials', 'Health Care', 'Industrials', 'Real Estate', 'Technology', 'Telecommunications', 'Utilities']"
126,VWSTX,Muni National Short,"This fund’s investment objective is to seek to provide current income that is exempt from federal personal income taxes, with limited price volatility. At least 75% of the securities held by the fund are municipal bonds in the top three credit-rating categories as determined by a nationally recognized statistical rating organization or, if unrated, determined to be of comparable quality by the advisor. The fund may invest up to 20% of its assets in medium-grade quality bonds, as determined by a rating organization or by the advisor. The remaining 5% may be invested in securities with lower credit ratings or, if unrated, determined to be of comparable quality by the advisor. The fund has some potential for higher yield than a money market fund because it holds longer-maturity securities. Along with the potential for higher yield, however, comes an increase in risk. A decline in interest rates can lead to less income for short-term bond funds, while a rise in interest rates can put pressure on the fund’s share price. Investors looking for a fund that seeks to provide modest federal tax-exempt interest income and can tolerate some income and share price risk may wish to consider this fund.",Fixed Income,1,['North America'],
127,VTSNX,Foreign Large Blend,"This fund offers investors a low cost way to gain equity exposure to both developed and emerging international economies. The fund tracks stock markets all over the globe, with the exception of the United States. Because it invests in non-U.S. stocks, including those in developed and emerging markets, the fund can be more volatile than a domestic fund. Long-term investors who want to add a diversified international equity position to their portfolio might want to consider this fund as an option.",Equity,5,"['Emerging Markets', 'Europe', 'Pacific', 'Middle East', 'North America', 'Other']",
128,VBIPX,Short-Term Bond,"This index fund offers a low-cost, diversified approach to bond investing, providing broad exposure to U.S. investment-grade bonds with maturities from one to five years. Reflecting this goal, the fund invests about 30% of assets in corporate bonds and 70% in U.S. government bonds within that maturity range. A key risk of the fund is the fact that changes in interest rates can eventually lead to a decrease in income for the fund. Investors with a short-term savings goal who are willing to accept some price movement may wish to consider this fund.",Fixed Income,1,['North America'],
129,VHCIX,Health,"This low-cost index fund offers exposure to the health care sector of the U.S. equity market, which includes stocks of companies involved in providing medical or health care products, services, technology, or equipment. The fund’s main risk is its narrow scope—it invests solely in health care stocks. An investor should expect high volatility from the fund, which should be considered only as a small portion of an already well-diversified portfolio.",Equity,5,['North America'],"['Biotechnology', 'Health Care Distributors', 'Health Care Equipment', 'Health Care Facilities', 'Health Care Services', 'Health Care Supplies', 'Health Care Technology', 'Life Sciences Tools & Services', 'Managed Health Care', 'Pharmaceuticals']"
130,VLCAX,Large Blend,"This fund provides broad, low-cost exposure to the large-capitalization market by investing in the U.S. stocks that represent the top 85% of market capitalization. In addition to general stock market volatility, the fund’s primary risk comes from the fact that its strategy of investing only in stocks of large U.S. companies may restrain its returns when other market segments outperform. Long-term investors seeking exposure to the largest U.S. stocks may wish to consider this fund.",Equity,4,['North America'],"['Basic Materials', 'Consumer Discretionary', 'Consumer Staples', 'Energy', 'Financials', 'Health Care', 'Industrials', 'Real Estate', 'Technology', 'Telecommunications', 'Utilities']"
131,VDC,Consumer Staples,"Seeks to track the performance of a benchmark index that measures the investment return of stocks in the consumer staples sector.Passively managed, using a full-replication strategy when possible and a sampling strategy if regulatory constraints dictate.Includes stocks of companies that provide direct-to-consumer products that, based on consumer spending habits, are considered nondiscretionary.",Equity,5,['North America'],"['Agricultural Products & Services', 'Brewers', 'Consumer Staples Merchandise Retail', 'Distillers & Vintners', 'Drug Retail', 'Food Distributors', 'Food Retail', 'Household Products', 'Packaged Foods & Meats', 'Personal Care Products', 'Soft Drinks & Non-alcoholic Beverages', 'Tobacco']"
132,VOOG,Large Growth,"The fund may not purchase securities of any issuer if, as a result, more than 5% of the fund’s total assets would be invested in that issuer’s securities; except as may be necessary to approximate the composition of its target index. This limitation does not apply to obligations of the U.S. government or its agencies or instrumentalities.",Equity,4,['North America'],"['Communication Services', 'Consumer Discretionary', 'Consumer Staples', 'Energy', 'Financials', 'Health Care', 'Industrials', 'Information Technology', 'Materials', 'Real Estate', 'Utilities']"
133,VUBFX,Short-Term Bond,"The fund’s investment objective is to seek to provide current income while maintaining limited price volatility. The fund invests in a diversified portfolio of high-quality and, to a lesser extent, medium-quality fixed income securities. The fund is expected to maintain a dollar-weighted average maturity of 0 to 2 years. Under normal circumstances, the fund will invest at least 80% of its assets in fixed income securities. The fund is designed to give investors low-cost exposure to money market instruments and short-term high-quality bonds, including asset-backed, government, and investment-grade corporate securities. Although short-term bond funds tend to have a higher yield than money market funds, their share price fluctuates. Because the Ultra-Short-Term Bond Fund will subject investors to principal risk, the fund shouldn’t be viewed as a substitute for a money market fund. Additionally, increases in interest rates can cause the prices of the bonds in the portfolio, and thus the fund’s share price, to decrease.",Fixed Income,1,['North America'],
134,VFICX,Intermediate-Term Bond,"This fund provides diversified exposure to medium- and high-quality investment-grade bonds with an average maturity of five to ten years. Reflecting this goal, the fund invests in corporate bonds, pooled consumer loans, and U.S. government bonds within that maturity range. Risks of the fund include the fact that changes in interest rates, both up and down, can affect the fund by resulting in lower bond prices or an eventual decrease in income for the fund. Because the fund invests in only one maturity segment of the fixed income market, it may be considered complementary to a core bond holding in an investment portfolio.",Fixed Income,2,['North America'],
135,VFMFX,Equity,"Managed by Vanguard Quantitative Equity Group (QEG), this fund seeks to identify U.S. common stocks with the potential to generate higher returns relative to the broad U.S. equity market. QEG uses a proprietary screening model that ranks stocks on factors such as momentum, quality, and value. In general, the portfolio holds stocks that exhibit relatively strong recent performance, strong fundamentals, and low prices relative to fundamentals as determined by the advisor. Another key attribute is the fund’s diversification—it invests in a mix of large-, mid-, and small-capitalization stocks that span different market sectors and industry groups. Under normal circumstances, typically at least 80% of the fund’s assets will be invested in securities issued by U.S. companies. Investors with a long-term time horizon who are willing to accept stock market risk may wish to consider this fund as a complement to a well-diversified portfolio.",Equity,4,['North America'],"['Basic Materials', 'Consumer Discretionary', 'Consumer Staples', 'Energy', 'Financials', 'Health Care', 'Industrials', 'Real Estate', 'Technology', 'Telecommunications']"
136,VCITX,Muni California Long,"The fund’s investment objective is to seek to provide current income that is exempt from both federal and California personal income taxes. The fund is intended for California residents only. It invests primarily in high-quality municipal bonds issued by California state and local governments, as well as by regional government and public financing authorities. Under normal circumstances, at least 80% of the fund’s assets will be invested in securities whose income is exempt from federal and California state taxes. Although the fund has no limitations on the maturities of individual securities, its dollar-weighted average maturity is expected to be between 10 and 25 years. The fund has an average duration of approximately 6-10 years, making its share price considerably more susceptible to changes in interest rates than shorter-term bond funds. Investors who are looking for a fund that may provide federal and California state tax-exempt interest income and can tolerate interest rate risk may wish to consider this fund.",Fixed Income,3,['North America'],
137,VIS,Industrials,"Seeks to track the performance of a benchmark index that measures the investment return of stocks in the industrials sector.Passively managed, using a full-replication strategy when possible and a sampling strategy if regulatory constraints dictate.Includes stocks of companies that convert unfinished goods into finished durables used to manufacture other goods or provide services.",Equity,5,['North America'],"['Aerospace & Defense', 'Agricultural & Farm Machinery', 'Air Freight & Logistics', 'Building Products', 'Cargo Ground Transportation', 'Commercial Printing', 'Construction & Engineering', 'Construction Machinery & Heavy Transportation Equipment', 'Data Processing & Outsourced Services', 'Diversified Support Services', 'Electrical Components & Equipment', 'Environmental & Facilities Services', 'Heavy Electrical Equipment', 'Human Resource & Employment Services', 'Industrial Conglomerates', 'Industrial Machinery & Supplies & Components', 'Marine Transportation', 'Office Services & Supplies', 'Passenger Airlines', 'Passenger Ground Transportation', 'Rail Transportation', 'Research & Consulting Services', 'Security & Alarm Services', 'Trading Companies & Distributors']"
138,VGSH,Short Government,Seeks to provide current income with modest price fluctuation.Invests primarily in high-quality (investment-grade) U.S. Treasury bonds.Maintains a dollar-weighted average maturity of 1 to 3 years.,Fixed Income,1,['North America'],
139,BSV,Short-Term Bond,"Seeks to track the performance of the Bloomberg U.S. 1–5 Year Government/Credit Float Adjusted Index, a market-weighted bond index that covers investment-grade bonds with a dollar-weighted average maturity of 1 to 5 years.Invests in U.S. government, high-quality (investment-grade) corporate, and investment-grade international dollar-denominated bonds.Follows a passively managed, index sampling approach.",Fixed Income,1,['North America'],
140,VYM,Large Value,"Seeks to track the performance of the FTSE® High Dividend Yield Index, which measures the investment return of common stocks of companies characterized by high dividend yields.Provides a convenient way to track the performance of stocks that are forecasted to have above-average dividend yields.Follows a passively managed, full-replication approach.",Equity,4,['North America'],"['Basic Materials', 'Consumer Discretionary', 'Consumer Staples', 'Energy', 'Financials', 'Health Care', 'Industrials', 'Technology', 'Telecommunications', 'Utilities']"
141,VFITX,Intermediate Government,"This fund at a minimum invests 80% of the assets in debt issued directly by the government in the form of Treasury bills, notes or bonds (including inflation-protected securities) and may invest in other securities including, but not limited to debt issued by federal agencies that are sponsored, guaranteed, or owned by the federal government. A key risk of the fund is the fact that changes in interest rates, both up and down, can affect the fund by resulting in lower bond prices or an eventual decrease in income for the fund. Investors who are looking for a fund that seeks to provide interest income and are able to tolerate moderate price and income fluctuations may wish to consider this fund.",Fixed Income,2,['North America'],
142,VSTCX,Small Blend,"This actively managed fund offers broad exposure to domestic small-capitalization stocks that the advisor believes have above-average return potential. The advisor relies on a computer-driven stock selection process in an attempt to build a portfolio with risk characteristics similar to those of the fund’s comparative index, while seeking to provide better returns. One of the fund’s risks is its focus on small-cap companies, which can be a volatile segment of the market. As a result, the fund’s returns may vary widely from year to year. An investor with a well-balanced, long-term portfolio who seeks exposure to small-cap companies may wish to consider this fund.",Equity,5,['North America'],"['Communication Services', 'Consumer Discretionary', 'Consumer Staples', 'Energy', 'Financials', 'Health Care', 'Industrials', 'Information Technology', 'Materials', 'Real Estate', 'Utilities']"
143,VEMPX,Mid Blend,"This fund offers investors a low-cost way to gain broad exposure to U.S. mid- and small-capitalization stocks in one fund. The fund invests in about 3,000 stocks, which span many different industries and account for about one-fourth of the market-cap of the U.S. stock market. One of the fund’s risks is its full exposure to the mid- and small-cap markets, which tend to be more volatile than the large-cap market. The fund is considered a complement to Vanguard 500 Index Fund. Together they provide exposure to the entire U.S. equity market.",Equity,5,['North America'],"['Communication Services', 'Consumer Discretionary', 'Consumer Staples', 'Energy', 'Financials', 'Health Care', 'Industrials', 'Information Technology', 'Materials', 'Real Estate', 'Utilities']"
144,VUSFX,Short-Term Bond,"The fund’s investment objective is to seek to provide current income while maintaining limited price volatility. The fund invests in a diversified portfolio of high-quality and, to a lesser extent, medium-quality fixed income securities. The fund is expected to maintain a dollar-weighted average maturity of 0 to 2 years. Under normal circumstances, the fund will invest at least 80% of its assets in fixed income securities. The fund is designed to give investors low-cost exposure to money market instruments and short-term high-quality bonds, including asset-backed, government, and investment-grade corporate securities. Although short-term bond funds tend to have a higher yield than money market funds, their share price fluctuates. Because the Ultra-Short-Term Bond Fund will subject investors to principal risk, the fund shouldn’t be viewed as a substitute for a money market fund. Additionally, increases in interest rates can cause the prices of the bonds in the portfolio, and thus the fund’s share price, to decrease.",Fixed Income,1,['North America'],
145,VLGSX,Long Government,"This fund employs an indexing investment approach designed to track the performance of the Bloomberg U.S. Long Treasury Bond Index. This Index includes fixed income securities issued by the U.S. Treasury (not including inflation protected bonds), with maturities greater than 10 years. Because long-term bonds tend to be very sensitive to interest-rate changes, one of the fund’s key risks is that increases in interest rates may reduce the price of the bonds in the portfolio, which would reduce the fund’s share price. Investors who are looking for a fund that seeks to provide interest income and are able to tolerate significant interest rate risk may wish to consider this fund.",Fixed Income,3,['North America'],
146,VYMI,Foreign Large Value,"Seeks to track the performance of the FTSE All-World ex US High Dividend Yield Index.Provides a convenient way to get exposure to international stocks that are forecasted to have above-average dividend yields.Employs a passively managed, sampling strategy.",Equity,5,"['Emerging Markets', 'Europe', 'Pacific', 'Middle East', 'North America', 'Other']",
147,VEUPX,Europe Stock,"This index fund provides investors low-cost exposure to the European stock markets. The fund holds more than 1,200 stocks across the European region, which makes up roughly half of the non-U.S. equity marketplace. In addition to stock market risk, the fund is also subject to currency risk and may have a higher degree of country risk than other international funds, since it invests solely in stocks of European countries. Long-term investors seeking exposure to European equities may wish to consider this fund as part of a diversified portfolio.",Equity,5,"['Europe', 'Other']",
148,VHYAX,Large Value,"This index fund seeks to track a benchmark that provides broad exposure to U.S. companies that are dedicated to consistently paying larger-than-average dividends. In addition to general stock market risks, the fund’s emphasis on slower-growing, higher-yielding companies can also mean that its total return may not be as strong in a significant bull market. This income-focused fund may be appropriate for investors who have a long-term investment goal and a tolerance for stock market volatility.",Equity,4,['North America'],"['Basic Materials', 'Consumer Discretionary', 'Consumer Staples', 'Energy', 'Financials', 'Health Care', 'Industrials', 'Technology', 'Telecommunications', 'Utilities']"
149,VDEQX,Large Blend,"This fund invests in six underlying Vanguard stock funds, providing investors with broad exposure to the U.S. equity market. Each underlying fund is actively managed and has a distinct investment approach. Together, the funds cover the style and capitalization spectrum by investing in growth and value, as well as small-, mid-, and large-cap companies. While this mosaic of investment approaches provides diversification benefits, it is not without risk. A primary risk stems from the fund’s full exposure to the stock market. Investors who consider this fund should have a longer time horizon, since this fund could be volatile in the short term.",Equity,4,['North America'],
150,VRTGX,Small Growth,"Invests in stocks in the Russell 2000 Growth Index, a broadly diversified index predominantly made up of growth stocks of small U.S. companies.Seeks to closely track the index’s return, which is considered a gauge of small-cap growth U.S. stock returns.Offers high potential for investment growth; share value typically rises and falls more sharply than that of funds holding bonds.More appropriate for long-term goals where your money’s growth is essential.",Equity,5,['North America'],"['Basic Materials', 'Consumer Discretionary', 'Consumer Staples', 'Energy', 'Financials', 'Health Care', 'Industrials', 'Real Estate', 'Technology', 'Telecommunications', 'Utilities']"
151,VEVFX,Small Value,"The Explorer Value Fund invests in small and mid-sized U.S. companies that, in the advisor’s judgment, are mispriced by the market. The fund’s portfolio management teams each have over 20 years of experience investing in the value market. Because of its focus on small and mid-sized companies, the fund tends to be more volatile than stock funds that focus on larger companies. This fund may be considered complementary to an already diversified portfolio with a long-term time horizon.",Equity,5,['North America'],"['Communication Services', 'Consumer Discretionary', 'Consumer Staples', 'Energy', 'Financials', 'Health Care', 'Industrials', 'Information Technology', 'Materials', 'Real Estate', 'Utilities']"
152,VMCIX,Mid Blend,"This low-cost index fund provides broad mid-capitalization U.S. equity exposure. The fund seeks to track an index of medium-sized companies, whose stocks tend to be more volatile than those of larger companies. This potential volatility is one of the fund’s key risks. Investors looking to add a passively managed, mid-cap stock allocation to an already diversified portfolio may wish to consider this fund.",Equity,5,['North America'],"['Basic Materials', 'Consumer Discretionary', 'Consumer Staples', 'Energy', 'Financials', 'Health Care', 'Industrials', 'Real Estate', 'Technology', 'Telecommunications', 'Utilities']"
153,VWIGX,Foreign Large Growth,"The International Growth Fund focuses on non-U.S. companies with high growth potential. Created in 1981, the fund employs an aggressive approach that attempts to capitalize on global economic expansion. For example, an attractive investment opportunity could be a non-U.S. consumer-products company that is experiencing rapid earnings growth. Because it invests in non-U.S. stocks, including those in developed and emerging markets, the fund can be more volatile than a domestic fund. Investors may wish to consider investing in this fund as a complement to an already diversified stock portfolio.",Equity,5,"['Emerging Markets', 'Europe', 'Pacific', 'Middle East', 'North America', 'Other']",
154,VCOBX,Intermediate-Term Bond,"This actively managed fund seeks to provide broadly diversified exposure predominantly to the U.S. investment-grade bond market. The low-cost fund invests in U.S. Treasury, mortgage-backed, and corporate securities of varying yields and maturities (short-, intermediate-, and long-term issues). Using a disciplined, risk-controlled approach, the fund seeks to outperform the broad investment-grade market through security selection, sector allocation, and, to a lesser extent, duration decisions. Like other bond funds, the fund is subject to interest rate risk; increases in interest rates may cause the price of the bonds in the portfolio to decrease, reducing the fund’s NAV. Since the fund invests in all major segments and maturities of the investment-grade fixed income market, investors may consider the fund as a core bond holding.",Fixed Income,2,['North America'],
155,VTIFX,World Bond,"This fund is designed to provide broad exposure to non-U.S. investment-grade bonds. The fund seeks to track the performance of an index that includes international government, agency, and corporate securities, mostly from developed countries, but also some emerging markets countries. Like other bond funds, the fund is subject to interest rate risk; increases in interest rates may cause the price of the bonds in the portfolio to decrease, reducing the fund’s NAV. Because it invests in non-U.S. bonds, the fund is also subject to additional risks, such as country/regional risk. The fund employs currency hedging strategies to protect against uncertainty in future exchange rates, so investment returns are expected to reflect the underlying performance of international bonds. Long-term investors who want to add an international position to their bond portfolio may wish to consider this fund as an option.",Fixed Income,2,"['Emerging Markets', 'Europe', 'Pacific', 'Middle East', 'North America', 'Other']",
156,VV,Large Blend,"Seeks to track the performance of the CRSP US Large Cap Index.Provides a convenient way to match the performance of a diversified group of stocks of large U.S. companies.Follows a passively managed, full-replication approach.",Equity,4,['North America'],"['Basic Materials', 'Consumer Discretionary', 'Consumer Staples', 'Energy', 'Financials', 'Health Care', 'Industrials', 'Real Estate', 'Technology', 'Telecommunications', 'Utilities']"
157,VITNX,Large Blend,"Seeks to track the performance of the CRSP US Total Market Index.Invests in large, mid-, and small-cap stocks diversified across growth and value styles.Passively managed, using index sampling.",Equity,4,['North America'],"['Basic Materials', 'Consumer Discretionary', 'Consumer Staples', 'Energy', 'Financials', 'Health Care', 'Industrials', 'Real Estate', 'Technology', 'Telecommunications', 'Utilities']"
